{
  "$schema": "https://json-schema.org/draft/2020-12/schema",
  "type": "object",
  "properties": {
    "$schema": {
      "type": "string"
    },
    "name": {
      "type": "string",
      "pattern": "^[a-z0-9][a-z0-9-]*(,[a-z0-9][a-z0-9-]*)*$"
    },
    "description": {
      "type": "string"
    },
    "tags": {
      "type": "array",
      "items": {
        "type": "string"
      }
    },
    "extends": {
      "anyOf": [
        {
          "type": "string"
        },
        {
          "type": "array",
          "items": {
            "type": "string"
          }
        }
      ]
    },
    "path": {
      "type": "string",
      "format": "starts_with",
      "pattern": "^\\/.*"
    },
    "url": {
      "type": "object",
      "propertyNames": {
        "type": "string"
      },
      "additionalProperties": {
        "type": [
          "string",
          "null"
        ]
      }
    },
    "network": {
      "type": "array",
      "items": {
        "type": "object",
        "properties": {
          "method": {
            "default": "GET",
            "type": "string",
            "enum": [
              "GET",
              "POST",
              "PUT",
              "PATCH",
              "DELETE",
              "HEAD",
              "OPTIONS"
            ]
          },
          "path": {
            "type": "string",
            "minLength": 1
          },
          "query": {
            "type": "object",
            "propertyNames": {
              "type": "string"
            },
            "additionalProperties": {
              "type": "string"
            }
          },
          "response": {
            "type": "object",
            "properties": {
              "status": {
                "default": 200,
                "type": "integer",
                "minimum": -9007199254740991,
                "maximum": 9007199254740991
              },
              "body": {
                "$ref": "#/$defs/__schema0"
              },
              "text": {
                "type": "string"
              },
              "headers": {
                "type": "object",
                "propertyNames": {
                  "type": "string"
                },
                "additionalProperties": {
                  "type": "string"
                }
              },
              "delay": {
                "anyOf": [
                  {
                    "type": "number",
                    "minimum": 0
                  },
                  {
                    "type": "string",
                    "const": "infinite"
                  }
                ]
              }
            },
            "not": {
              "required": [
                "body",
                "text"
              ]
            }
          },
          "sequence": {
            "minItems": 1,
            "type": "array",
            "items": {
              "type": "object",
              "properties": {
                "status": {
                  "default": 200,
                  "type": "integer",
                  "minimum": -9007199254740991,
                  "maximum": 9007199254740991
                },
                "body": {
                  "$ref": "#/$defs/__schema0"
                },
                "text": {
                  "type": "string"
                },
                "headers": {
                  "type": "object",
                  "propertyNames": {
                    "type": "string"
                  },
                  "additionalProperties": {
                    "type": "string"
                  }
                },
                "delay": {
                  "anyOf": [
                    {
                      "type": "number",
                      "minimum": 0
                    },
                    {
                      "type": "string",
                      "const": "infinite"
                    }
                  ]
                }
              },
              "not": {
                "required": [
                  "body",
                  "text"
                ]
              }
            }
          },
          "remove": {
            "type": "boolean",
            "const": true
          }
        },
        "required": [
          "path"
        ],
        "oneOf": [
          {
            "required": [
              "response"
            ]
          },
          {
            "required": [
              "sequence"
            ]
          },
          {
            "required": [
              "remove"
            ]
          }
        ]
      }
    },
    "handlers": {
      "type": "array",
      "items": {
        "type": "string",
        "minLength": 1
      }
    },
    "state": {
      "type": "object",
      "properties": {
        "tanstack-query": {
          "type": "array",
          "items": {
            "type": "object",
            "properties": {
              "queryKey": {
                "minItems": 1,
                "type": "array",
                "items": {
                  "$ref": "#/$defs/__schema0"
                }
              },
              "data": {
                "$ref": "#/$defs/__schema0"
              },
              "stale": {
                "type": "boolean"
              }
            },
            "required": [
              "queryKey",
              "data"
            ]
          }
        }
      },
      "additionalProperties": {
        "$ref": "#/$defs/__schema0"
      }
    },
    "ready": {
      "type": "string"
    },
    "viewport": {
      "type": "object",
      "properties": {
        "width": {
          "type": "integer",
          "exclusiveMinimum": 0,
          "maximum": 9007199254740991
        },
        "height": {
          "type": "integer",
          "exclusiveMinimum": 0,
          "maximum": 9007199254740991
        }
      },
      "required": [
        "width",
        "height"
      ]
    }
  },
  "required": [
    "name"
  ],
  "$defs": {
    "__schema0": {
      "anyOf": [
        {
          "type": "string"
        },
        {
          "type": "number"
        },
        {
          "type": "boolean"
        },
        {
          "type": "null"
        },
        {
          "type": "array",
          "items": {
            "$ref": "#/$defs/__schema0"
          }
        },
        {
          "type": "object",
          "propertyNames": {
            "type": "string"
          },
          "additionalProperties": {
            "$ref": "#/$defs/__schema0"
          }
        }
      ]
    }
  }
}
